Generic Name,Brand Name(s),Drug Class,Dosage Forms,Indication,Side Effects,Clinical Pearls
Olanzapine,Zyprexa,Second generation "atypical" antipsychotic,Tablet,"Bipolar disorder, treatment-resistant MDD, schizophrenia, acute agitation","Weight gain, metabolic effects","Second-generation antipsychotic, highest weight gain risk among SGAs"
Quetiapine,Seroquel,Second generation "atypical" antipsychotic,Tablet,"Bipolar disorder, schizophrenia, MDD adjunct","Metabolic effects, sedation","Second-generation antipsychotic, off-label use for sleep"
Risperidone,Risperdal,Second generation "atypical" antipsychotic,Tablet,"Bipolar mania, schizophrenia, autism irritability","Hyperprolactinemia, metabolic effects","Second-generation antipsychotic, highest prolactin risk among SGAs"
Clozapine,Clozaril,Second generation "atypical" antipsychotic,Tablet,"Treatment-resistant schizophrenia, suicidal behavior in schizophrenia","Sedation, anticholinergic effects, weight gain, severe neutropenia","Most effective antipsychotic but most severe side effects, requires ANC monitoring"

# NEUROLOGY (115-124)
Oxcarbazepine,Trileptal,Anticonvulsant,"Tablet ER, Suspension",Partial seizures,"Nausea, dizziness, drowsiness, hyponatremia, hypersensitivity reactions","CYP3A4 inducer, drug interactions"
Phenobarbital,Luminal,Anticonvulsant,Tablet,"Seizures, status epilepticus, sedation","CNS depression, respiratory depression, CV effects","Strong CYP3A4 inducer, controlled substance, therapeutic drug monitoring"
Phenytoin,Dilantin,Anticonvulsant,"Chewable Tablet, Capsule, Suspension","Seizures, status epilepticus","CNS depression, blood dyscrasias, CV effects, hepatotoxicity","Strong CYP3A4 inducer, therapeutic drug monitoring"
Topiramate,Topamax,Anticonvulsant,"Tablet, Capsule ER, ER Sprinkle","Seizures, migraine prophylaxis","Abdominal pain, low appetite, dizziness, kidney stones, cognitive dysfunction, weight loss","FDA-approved with phentermine for weight loss"
Carbamazepine,Tegretol,Anticonvulsant/Mood Stabilizer,Tablet,"Seizures, bipolar disorder, neuropathic pain","Nausea, dizziness, blood dyscrasias, hyponatremia, hepatotoxicity","Strong CYP3A4 inducer, therapeutic drug monitoring, genetic testing"
Divalproex,Depakote,Anticonvulsant/Mood Stabilizer,"ER/DR Tablet, DR Capsule Sprinkles","Bipolar disorder, seizures, migraine prophylaxis","Nausea, weight gain, somnolence, hepatotoxicity, pancreatitis, thrombocytopenia","Multiple dosage forms, therapeutic drug monitoring, teratogenic"
Lamotrigine,Lamictal,Anticonvulsant/Mood Stabilizer,"Tablet, Chewable, ODT, ER","Bipolar disorder, seizures","Dizziness, somnolence, gait issues, serious skin rashes","Must be titrated very slowly over weeks, drug interaction with valproic acid"
Lithium,Lithobid,Anticonvulsant/Mood Stabilizer,"Tablet, Capsule, Solution","Bipolar disorder (mania, mixed episodes, maintenance)","Cardiac effects, CNS effects, N/V/D, hypothyroidism, renal effects, tremor, weight gain","Narrow therapeutic index, therapeutic drug monitoring essential"
Gabapentin,Neurontin,Anticonvulsant/Neuropathic Pain Agent,"Tablet, ER Tablet, Capsule, Solution, Suspension","Postherpetic neuralgia, seizures","Dizziness, drowsiness, fatigue, gait issues, CNS/respiratory depression","Often used off-label for diabetic neuropathy, renal dosing, controlled substance in some states"
Pregabalin,Lyrica,Anticonvulsant/Neuropathic Pain Agent,Capsule,"Postherpetic neuralgia, diabetic neuropathy, spinal cord injury neuropathy, fibromyalgia, seizures","Dizziness, drowsiness, visual disturbances, dry mouth, edema, weight gain","Renal dosing, controlled substance"